escola;genero;ano;enredo;letra
Estácio de Sá;Samba-Enredo;2019;;"Bendito seja sou o fruto do senhor. Santificado nazareno do amor. Oh! Pai, oh! Virgem Maria. Abençoai seu peregrino em romaria. De joelhos no altar lhe oferto. Meu poderoso eu peço. Sua graça em comunhão. Procuro estar em sua companhia. Para curar minhas feridas. Confortar meu coração. Do fogo reluz Ave Sagrada. Meu Deus de tantas moradas. Um fiel em devoção.
Senhor. Senhor é divino, é encanto. O canal de amor. Para unir dois oceanos. Um panamenho estaciano filho seu. A imagem e semelhança sou eu.
Pai nosso da negra tez. Sagrado Rei dos Reis. Obatalá. Rege o palanque em procissão. Devotos clamam em oração. Pra vitória conquistar. Amém, os tambores. Vão rufar pra louvar. E levar a minha Estácio de Sá. Sua gloria alcançar.
A fé que embala a alma. Emerge das águas. Trazendo esperança. O Cristo negro salvador da cruz. Protetor da humanidade. Caminho de luz."
Estado Maior da Restinga;Samba-Enredo;1981;;"De repente, não mais que de repente. Eu fui sentir o soneto da hora final. Partiu o pai maior da poesia. Mestre em diplomacia. O Orfeu do carnaval.
No soneto da fidelidade. Encenou toda a verdade. Que fundamentou o seu ser.
Aulas infinitas de inconstância. Amor, misticismo e distancia. De receita de mulher.
Como ele não tinha confronto ao tema. Veja a garota de Ipanema. Musicada pelo velho tom. E como anjo o poeta nunca morre. Vou também tomar um porre. Perguntar e agora vou.
Vem pra sempre do infinito. Enquanto dure. Verso que sempre perdure. Pois prova que é liberdade. Vem com a restinga se unir a cantar. O poeta do declamar. E da linda canção felicidade.
Tristeza não tem fim. É o que o poeta maior vem ensinar. Felicidade sim. O meu povão na avenida. Alegre vai cantar."
Estado Maior da Restinga;Samba-Enredo;1992;;"Traga o meu colar de contas para iemanja benzer. Lerere, ierere, ierere.
Tá na hora do show da vida começar (vai começar). É a Tinga novamente. Há muito que te quer mostrar. Coisas que dormem no tempo. E o próprio tempo despertou.
O mar, oh o mar. Misterioso mar, misterioso mar. Que desagua na folia. Como é doce recordar.
A lendária história conta. Que foi Netuno o grande criador. O escolhido entre o deuses. E que Atlântida criou. O palácio de prata e dourado. Onde o seu filho reinou. O cavalo alado e a terra fértil com amor.
Ele vem girando se deitar na areia. Na areia exumar, na areia.
Cantam iaôs, louvando a sereias do mar. Mãe Iemanjá, mamãe Oxum hoje vão cantar. Um só por todos e todos por um."
Estado Maior da Restinga;Samba-Enredo;2000;;"Os monarcas assinaram o tratado de Madri. Invadiram o solo guarani. Mas a força de um povo não se rendeu. Porque esse chão sempre foi seu.
Sepé Tiarajú deu seu grito de guerra. Esta terra já tem dono!. Já tem dono esta terra!. Vem com a Restinga. Festejar a vitória da cidade. Brincando eu digo a verdade.
Tinga, meu amor. São João Baptista vem dizer que te adorou. Tu és eterna, a comunidade chama. Tinga teu povo te ama.
Brilhou a luz de São Miguel. Ao som de hinos de louvor ao criador. Meu cisne mostra o show. Com águas cristalinas. Gira baiana, leva axé pra essa avenida.
A população então crescia. Era preciso uma nova redução. São Miguel com a sua luz divina. O jardim do Éden encontrou.
Padre Antônio Sepp foi o escultor. Da terra prometida pelo nosso criador. Na extensão do paraíso. Vou cantar com emoção. Restinga embala o meu coração.
Ás margens do arroio, é São João Baptista. Plantaram a cruz e a pedra monumental. Ofícios e o barroco missioneiro. Trazem a cultura para este carnaval."
Estado Maior da Restinga;Samba-Enredo;2001;;"Requebra as cadeiras ai. Mascarado também vou ficar. Se mostrar tua face pra mim. Restingando eu vou desvendar.
Vem brincar, cantar. Soltar alegria, extravasar. Sou tinga e dai, não vou negar. Outra face na avenida. O cisne hoje vem mostrar.
Máscaras em volta. A lenda avançou. No tempo se eternizou. Homens despertam outra personalidade. No afã da liberdade. Bacanais e saturnais. Onde surgiu o carnaval. Consagração ao Deus pan. Permanece ainda o fogo sagrado. Palpitando em nossos corações.
Chegando a mãe louca. Já to louco que sufoco. A deusa da folia. Vem brincar no carnaval.
A deusa vem brincar no carnaval. A noite em Veneza era tradição. Arlequim e colombina. Prolongavam traição. Traído era pierrô. Praça são marcos era parte do amor."
Estado Maior da Restinga;Samba-Enredo;2012;;"Faz bem pra alma e pro coração. Deixa o meu samba te embriagar. Um sentimento sem moderação. Eu sou restinga.
Mania de erguer a taça. É o cisne, o meu orgulho. E meu maior prazer. Tingiu sua história de amor e de raça. Brindando vitórias, o povo se abraça. Em linda comunhão. É festa, luta em louvação. É o vinho, mitologia, caminho, filho de Zeus. Divinos cachos, passos. Baco em taças de ouro. Fez da sagrada cultura. O néctar da humanidade. Transbordou o velho mundo. E foi ganhando brasilidade.
No sul foi se espalhar. Missões a consagrar. Se apaixonou por essa terra. Subiu a serra e tanta qualidade fez brotar.
Mãos imigrantes nutriram o sonho. Brotou alegria. Ramos florescem, saber à altura. No gelo , a joia madura. Pelo velho chico, um jovem sabor. Meu rio grande projetou. Passado, presente, valor sem igual. Heranças do tempo colonial. Festa da uva, a nostalgia de caminhos de pedra. Os velhos trilhos da maria fumaça. Simbolizando, a história me espera. Tem cheiro de festa no ar. Exala o sabor que me chama. É hora de comemorar. Tinga, teu povo te ama!."
Estado Maior da Restinga;Samba-Enredo;2015;;"Vou navegar nas águas desse mar. Deixar a vida me levar. E a emoção vai explodir. Quando eu cantar sou Tinga! E daí?.
Amor. Vem mergulhar na fantasia. É lenda, mistério, magia no ar. Na busca de um ouro vai se revelar. Corsários, piratas, sereia do mar. Meu cisne!. Foi ela que encontrou você, meu grande amor. Cidade tão exuberante. Em Torres tudo é fascinante. O astro fez do meu calor, minha inspiração. A vida de um povo com seus rituais. Sua natureza que ao mundo encantou. Se banhando nas curvas de um rio. Que Deus abençoou.
Soldado valente guerreiro à lutar. Eu sou. Batida tão forte que rufa o tambor. Anunciou. Sou tinguerreiro vencedor. Meu escudo é tricolor.
Na tribo o amor acabou. E o farol, de longe o imigrante avistou. A fé na minha religião. Por total devoção na igreja eu senti. Sonhei, fiz um turismo, viajei. Pintei, Torres na tela de Debret. É pesca, é sol, é verão. Vai subir o balão,. Só faltava você. E na gastronomia, tudo é maravilhoso. É festa, feliz ano novo!. Uma índia eu avistei. Abraçada sobre um violão. Lágrimas de paixão. Amor que se iguala ao meu pavilhão. É a Tinga do meu coração."
Estrela do Terceiro Milênio;Samba-Enredo;2019;;"Canta, zona sul. A festa vai começar. Milênio é coragem!. Mete a mão, batuqueiro. No rufar do seu tambor. Leva essa mensagem ao mundo inteiro!.
É hora de voar. Me acolhe em suas asas, minha coruja. Iluminei meu caminhar. Com a chama acesa no peito. Pra vencer, realizar. Enfrentei batalhas e tormentos. Foi preciso coragem, se arriscar. Derrotar o forte, fazer a história. Não temer a morte, pra viver a glória. Seguir com fé desafiando a opressão. E compor a linda sinfonia da superação.
Somos nós que fazemos a vida. O impossível pode acontecer. Acreditar, querer e lutar. O sonho vai resplandecer!.
Vestido de esperança. Com paixão de um anjo protetor. Pela paz combati sem a guerra. Por justiça, plantei igualdade e amor. Hoje, sob a proteção de jorge. Meu Grajaú se faz mais forte. Liberta esse grito preso na garganta. Quero respeito! Chega de intolerância!. Por todas as crenças e cores. Por todos amores. Eu faço meu samba!."
Estrela Sambario;Samba-Enredo;2016;;"O tempo se propaga no vazio. Escorre sombrio por esse lugar. São almas que vagam acorrentadas. Ao desejo de vingança. Onde a ganância fez morada. Brilhou na escuridão a luz interior. E o mundo ao ser criado se espelhou. No Deus que habitou o ser humano. E ensinou o voo para a liberdade. Mas o homem provou da ambição e da maldade. A criatura então quis ser o criador. E a ira de um trovão se derramou .
Ôôô... Quando a terra virou mar. A fúria das águas veio castigar . Mas o ser divino o céu pintou. Recriou a vida com o seu calor .
Mas a paz ali não duraria. O espanhol numa sangrenta invasão. Montado em sua cavalaria. Legou os guerreiros à escravidão. Em dias de terror e sofrimento. Clamaram do lamento, a salvação. O grito esperado se ouviu. E a maldição ao invasor se cumpriu . Voar... bater as asas, se libertar. Poder voar, e encontrar. Lá no azul do infinito. O encanto de um futuro mais bonito. Metamorfose do meu carnaval .
Vem se transformar. Embarcar nessa viagem . Minha estrela vai brilhar. A alcançar a liberdade. Minha estrela a brilhar. O símbolo maior da liberdade."
Experimenta da Ilha da Conceição;Samba-Enredo;2015;;"Através dos tempos. Grandes civilizações. Procuram respostas dentro das constelações. Nascer e viver, plantar. Colher, como será?. Vamos perguntar aos astros. Certamente nos dirá.
Signo de áries é fogo. Touro, gêmeos, câncer ou leão. Experimenta, vem no comando do zodíaco. Para revelar sua visão.
Na evolução, mistérios a desvendar. Estudar planeta, terra, fogo, água e ar. A aurora boreal, o arco-íris, que esplendor. Já decifrei, meu mapa astral. Sou um grande vencedor.
Sou aquariano, gosto de sambar. Porque o samba está no meu DNA. Sou experimenta, meu signo vai brilhar. No carnaval eu vou zodiacar."
Experimenta da Ilha da Conceição;Samba-Enredo;2019;;"Olinda em festa no meu coração. Com Experimenta da Ilha da Conceição. Cabra da peste, arretado, sangue forte. Pernambucano, sou leão do norte.
Menino sonhador eu vou. Vivendo em brincadeiras. Ao som de clarins e zabumbas. Espalho amor pelas ladeiras. Tem pé de serra raiz, xote e baião. Na mão do mestre o barro é criação. Com alegria, o povo, no batuque embala. Desperta pro o galo da madrugada.
Batuqueiro tem a fé e proteção. O homem da meia noite vem puxando esse cordão. Das senzalas, do engenho ao folguedo. O maracatu enfeitiça o cortejo.
Gigante a tradição nordestina. Lá vem zé pereira e vitalina. Pulsa vibrante a massa. Invade as ruas, os bailes e praças. E os mamulengos lá de Glória do Goitá. Nos fazem viajar na fantasia. De sombrinha e papangu, tá formado o sururu. Vou pra dentro da folia.
No dobrado e na ginga do capoeira. O passo do frevo levanta a poeira."
Favela do Samba;Samba-Enredo;2019;;"O céu iluminou, tambor rufou. Com as graças do Senhor. O Anjo Haaiah festejou. Magos em legião abençoaram. Astros do universo se alinharam. Para o Viajante Cometa Divino. Chuva de estrela e meteoro acompanharam. O nascimento do Rei Menino. Com a missão de servir, a paz semear. Seu conhecimento compartilhar. Com a força da Terra (Mãe Gaia), água, fogo e ar!.
Sou Xamã, Sacerdote Carcará. Meu tambor sagrado vai ecoar. Eu vou proteger a sua jornada. Afastar o mal pra sua chegada.
Sou Xamã, Sacerdote Carcará. Meu tambor sagrado vai ecoar. Eu vou proteger a sua jornada. Quem é favelence ajuda na caminhada.
A sua arte é como um raio de sol. Que emana luz feito o clarão da lua!. Um mundo de imaginação. Mestre, designer da criação. Reciclando a vida o Armorial criou. Ninho nordestino com sotaque de amor. Se coreira pungou, bumba meu boi urrou. O artista aplaudiu, um reggae dançou. Com a proteção do Divino pela Favela se apaixonou!. E aquele sonho que você não realizou. Renasce das cinzas, em quem tanto te amou. Em uma linda história de seres encantados. Você se eternizou.
Sua alma ainda vive Jesiel. Em tudo que lembra você. A voz da arte que não cala. Vida que o tempo não faz esquecer!."
Feitiço do Rio;Samba-Enredo;2018;;"É bom ser criança na imaginação. Que sonha e avança rumo à ilusão. Encanta Feitiço e torna real. As peças do jogo no meu Carnaval.
A lua enfeitiçada tem magia. No mundo de fantasia vem trazer inspiração. Menino, que brinca durante o dia. Para sua alegria a noite tem mais emoção. Os olhos se fecharam lentamente. É tão inocentemente neste sonho se entregou. Ouviu chamar, mais de uma vez. Ditando as ordens a nobreza do xadrez.
Simbora moleque, vem com a gente brincar. Em devaneios, vem viajar. Peão guerreiro, cavaleiro e valente. É peça principal no Tabuleiro da Intendente.
Mistérios no ar, no reino da encantaria. De preto e branco, a dama desaparecia. Do perfil veio um palpite, logo virou detetive. Um novo caso assim surgia. Menino sonhador, faceiro. Fez do seu travesseiro sua proteção. Na vitória mata a sede. Navegando no oceano de fascinação. Raiou o Sol, no despertar de um novo dia. Realidade ou fantasia?. Sorte nos dados que viraram seis e seis. Guri resta só um impasse. Mais uma casa e xeque mate. Venceu de novo, vamos jogar mais uma vez."
Feitiço do Rio;Samba-Enredo;2019;;"Ecoa. O som do lamento do corpo sofrido. Da dor e tormenta de um povo aguerrido. Jogado à escravidão. Ressoa. Tambores de tribos sangradas na guerra. Humanos lançados numa nova terra. Feridos na garra da pura ambição. Explorado pra trabalho. Alienado em mercado a Senhor. Açoitado nos sobrados. Naquela pedra onde o sal tem mais valor.
Mercadoria, objeto. Sem liberdade e amor. Mas sua crença é sagrada. Tem um santo que é forte e alivia a sua dor.
E no granito, mãos e picareta. Ao braço, cavada degrau a degrau. Pequena África, no cais do Rio. Surgia, ali, a pedra do sal. De cabarés, botecos, boemia. O berço do samba, é felicidade. O adarrum retumba no atabaque. Quebrando a corrente da desigualdade.
Gira baiana, mãe do samba. Gira Ciata no terreiro de Alabá. Sente o batuque, de gente bamba. Lava a Avenida, que o Feitiço vai passar."
Fla Manguaça;Samba-Enredo;2019;;"Mengo,Mengo. É a hora do canto da massa. Canta Fla Manguaça . Ao meu eterno amor.
Ele é o que nunca se entrega . Aquele que diz que a glória e lutar. O velho marinheiro que navega. E chega na terra, festeja o mar. Vestiu o rubro quando ouviu o preconceito. Pois ser tão negra é pra gente se orgulhar .
Meu urubu é o rei, ganhou a nação . Soberano no infinito . Eternamente campeão.
Símbolo maior de igualdade . É a alma da favela a nossa identidade. Garra e atitude. A flor da pele o valor da negritude. Hoje 50 anos depois. É nossa marca, nosso sangue, nossa história.
Vamos sacudir a arquibancada. Pede mais uma gelada . Para saudar outra vitoria(do Flamengo)."
Flor da Mina do Andaraí;Samba-Enredo;2018;;"Salve Cosme e Damião. Por me proteger. Sou criança Flor da Mina. Só quero vencer. Aos gêmeos vou pedir. E esse dia nunca acabar.
Ontem eu dormi mais cedo. Nem do escuro tive medo. Meus santinhos Iriam me guardar. Amanheceu, o galo já cantou. Nem sei por onde começar. Separei chinelo e sacola. Já que não vai ter escola. Fui ao vizinho que ofertava à ibejada. Doces pra Florzinha e Pedrinho. E brinquedos pra criançada.
Iemanjá, cadê Doum?. Foi vadiar em busca de doçura. Tem quindim e tem cocada no gongá. Na festa das crianças. Nada vai faltar!.
Depois fui visitar papai do céu. Fechei os olhos, levantei a mão. Vovó me ensinou a ter gratidão. Aos anjos, pedi pelas crianças. Filhos da vida e do destino. Irmãos da esperança. Ao morro volto contente. E corro pros braços da minha Flor. Da mina, onde jorra a alegria. Brota felicidade e amor."
Flor da Mina do Andaraí;Samba-Enredo;2019;;"Carioca eu sou, malandragem. Fiz dessa floresta a minha paisagem. Um rio de amor pra gente sorrir. Com a Flor da Mina do Andaraí.
Ita Hangá. É pedra, é lenda Tupinambá. E Deus Tupã vai me guiar. Nessa sublime natureza. A fauna, a flora sem igual. As águas, sagrada criação. A floresta e seus encantos. Da Tijuca, o coração.
E pelo mar chegou família real. Ê negro café, a devastação. Nos canaviais, é só agonia. Lata d’água na cabeça, lá vai Maria.
O suor em cada grão. Da escravidão refloresce a vida. Salve o Barão que decretou afinal. O sonho de um Parque Nacional. Os portões se abrem ao lazer. De braços abertos, meu cartão postal. Vislumbra a beleza da vista Chinesa. A nossa riqueza virou carnaval. As pipas bailando em linda aquarela. No swing da favela."
Flor da Primavera;Samba-Enredo;2019;;"Eu me embalei nessa folia. De azul e branco no calor da bateria. E o poder que vem da floresta. Desabrocha nessa festa.
Na flora dos meus ancestrais. Soluções medicinais. Nesse mundo verde. Fonte do saber. Cura para alma, eu vou me benzer. O vento sopra, a folha cai. Os frutos que brotam. São bênçãos do pai. Semeio um jardim, uma quimera. Flor tão bela flor da primavera.
Okê, Arô, Okê, Arôle. Oxóssi é caçador, ôô. Logun Edé lançou a flecha. Firma o batuque no meu tambor.
No olhar de Pssain segredos. Macero as ervas que quebram o medo. Lendas, mistérios e magias. Na sabedoria do velho pajé. No alvorecer de cada dia emana fé. Sou dono da terra, o filho do chão. Caboclo guerreiro com a lança na mão. Na essência de Ewá, divina proteção.
Salve a preservação."
Flor da Vila Dalila;Samba-Enredo;2019;;"Os arautos anunciam. Minha vila vai passar. Dalila, a mais bela flor da minha vida. Da zona leste, a mais querida, a desfilar.
Viajei através das civilizações. Em busca do ouro para alcançar. A sabedoria milenar. Meus sonhos dourados. Vi nas areias do Egito. Reluz nas dadivas do Nilo. É sedução, mistério e fascinação.
Do olho de Hórus senti o poder. A música veio me purificar. Mumificando o corpo; minha alma. Vai se eternizar.
Vi a escrita nascer. Com a vida dos faraós. No berço da humanidade. Nesse luxuoso cenário. Surge o vinho a cerveja e nosso calendário. Vem, amor, tire o véu de Ísis não me leve a mal. Decifra-me ou devoro-ti no carnaval. Vestida de flores a rainha vem sambar. Aplausos a essa nossa linda trajetória. 45 anos de história, vamos comemorar."
Flor de Lótus;Samba-Enredo;2017;;"Em procissão, lá vem o povo. Movendo montanhas em estado de graça. É a flor de lotus, poesia de amor. Meu céu nessa terra é ela que passa.
A fé purifica a alma. Acalma ante a provação. É luz pra guiar sua estrada. Traçada em peregrinação. Destino a desbravar e um novo mundo encontrar. Para honrar o Criador. O jesuíta a caminhar. Ao horizonte (ôô) enfim partiu (ô ô ô). Rumo a terras portuguesas Salvador, Brasil!.
A pena que escreve o cocar. É a pena que enfeita o falar de José!. Um sentimento que invade o coração. Do peregrino da fé.
Voou por tabas de branco. Plantando orações foi rompendo grilhões. Eu sei que até hoje abençoa. Nossa terra da garoa. A paz e a liberdade que ele deixou na beira do mar. Ficaram gravadas na areia pra eternizar. Feitos e glórias num lindo poema. Afago que acena ao meu coração. Os passos de Anchieta. São caminhos pra devoção."
Flor de Vila Dalila;Samba-Enredo;1988;;"[Enredo: Nova República, Me Engana Que Eu Gosto.
Promessa fica na promessa. É hora de despertar. Chega de demagogia. Pra que tanta ironia. O povo está cansado de esperar.
Pra que cultura. Se não há emprego. A fome do país não é segredo.
Fabricaram o trem, parou a ferrovia. Falta de verba que o plenário discutia.
Me engana que eu gosto. Reforma agrária cadê?. O índio está cansado de sofrer.
O leão virou hiena, preocupado com a nação. Marajá de bolso largo. Nem abala o coração.
E o aposentado que merece mais respeito. E o menor abandonado. Sofre com o preconceito.
Me arrepia essa tal democracia. Acorda meu Brasil."
Flor de Vila Dalila;Samba-Enredo;2008;;"Vou cantar. Da liberdade eu sou o amante. A minha flor vem exaltar. A negritude de mentes brilhantes.
Passando a limpo a nossa história. A minha escola canta a a realidade. O destino me fez pobre. Mas eu tenho eu tenho sangue nobre. E quem foi rei nunca perde a majestade. Sei que fui escravizado da mãe África tomado. Mas sem perder o ideal. Lutar, sofrer, morrer mas se entregar jamais. O nero é amor é a verdade é a raiz da liberdade. Em busca dos direitos sociais. Ó palmares. Ó palmares refúgio das trevas. Aqui nestas terras palco de estratégias geniais. Ganga zumba e zumbi reis em solo guarani. Guerreiros de batalhas imortais. A revolta dos malês contra o jugo português. Sob a proteção de alá.
Na minha praia não vai ancorar. Clamava o dragão do mar.
Foi-se a escravatura veio a discriminação. Porém surgem novos movimentos. Enfocando argumentos de conscientização. E viva a flor de vila Dalila. Querida em todos carnavais. O samba é nosso quilombo onde todos são iguais."
Flor do Samba;Samba-Enredo;2019;;"É big bang!. A chama da evolução. A noite vira dia e na tela vazia. Reluz a natureza em expansão. Água, fogo, terra e ar.
E na sutileza o mundo a girar. Na dança do vento. No balanço das ondas do mar. Sou fio condutor dessa folia. Que vibra e impulsiona a máquina da vida.
É pura energia!. Vou nas batidas do seu coração. Fabulosa eletrizante. A fonte de tanta emoção.
Mas qual. Qual será o rumo a seguir?. A consequência?. O porvir?. É preciso consciência!. Gerar, renovar e preservar. É o desafio pra ciência. O amanhã como será?. Desterro, tu és a força do meu pavilhão. Me faz sentir a verdadeira emoção. Quando o sinal verde anunciar. Eu vou na fé, carregado de axé. Pra ver a minha Flor passar.
Brilhante como o Sol, eu sou a Flor. Viva essa energia, meu amor. Eu sou a luz que te conduz no carnaval. Levantando o seu astral."
;;;;
Folia do Viradouro;Samba-Enredo;2019;;"Padre Anchieta, olhai por nós!. Vem de Santa Rosa a nossa voz. Iluminai o nosso povo. Clama a Folia do Viradouro.
Na Espanha, José de Anchieta nasceu. Ainda menino seguiu seu destino. Em Portugal, educação cristã. Despertou devoção por nossa senhora. O noviço jesuíta partiu em missão. Desembarcou na Bahia de todos os santos. Rendeu-se aos encantos que aqui encontrou. No Alto de São Lourenço ao índio catequizou.
Lá se foi o peregrino. Por essas terras pregar a paz. À todos, direitos iguais. Na luta pra expulsar o invasor. A fé no arcanjo protetor.
Desbrava a fauna e a flora. A fera acalma num simples olhar. Joga a rede pescador. A maré de fartura chegou. Fascinação no altar. Divina imagem, levitação. Partiu pra encontrar o criador. A história eternizou, feitos e milagres. Nessa avenida hoje faz-se a oração. Sou mais um devoto. A vermelho e branco é o samba em procissão."
Gaviões da Fiel;Samba-Enredo;1989;;"[Enredo: O Preto E Branco Na Avenida.
Vem mostrar a garra e a raça. Em preto e branco balançar os corações.
Voa bem mais alto ora voa. Sacudindo a passarela gaviões.
Duas faces um contraste. É assim a natureza. Obra de pai oxalá (que beleza). Tão divinal é o poder da criação. Harmonia que foge à imaginação.
Clareia obaluae. Clareia a escuridão. Clareia para que negros e brancos. Enfim se reconheçam como irmãos.
Tem o preto, tem o branco, em tudo tem. A branco e preto colorindo o infinito. Nos sonhos ou em cada fantasia. Simbolizando a esperança em nossos dias. No samba e no futebol. Imprensa, cinema e televisão. É de fato o concreto e o abstrato. É força popular é tradição.
Eô, é o esplendor. A aliança entre os povos no Brasil. O estandarte altaneiro. A própria alma deste povo brasileiro."
Gaviões da Fiel;Samba-Enredo;1990;;"[Enredo: O Homem Nasceu Para Voar.
Sonhei, sonhei. Voando amor. Além do espaço sideral. Sou Gavião, sou multidão. Sou carnaval.
Sem fronteiras, sem limites. Solto as asas da imaginação. Sou um pássaro dourado. Ou um concorde turbinado. Pra pousar nos corações.
Imaginei. Como eu podia ser feliz. Voar num sonho tão bonito. No espaço infinito. Como um lindo beija-flor. Flutuar com a passarela. Num tapete voador. Eu acordei foi tudo ilusão. No asfalto o samba é empolgação.
Vem amore linda morena. Balançar comigo num balão.
É assim que eu vou sambar cantar. Como criança colocar pipas no ar. Neste palco da emoção. Vou de nave e de avião. Com o pai da aviação. E as máquinas que construi valeu. Digo que o voo sou eu.
Quem vai a lua vai ao sol. E as estrela porque. Livre voando vivo a era espacial."
Gaviões da Fiel;Samba-Enredo;1991;;"[Enredo: A Dança Das Horas.
O caminhar do astro rei. Vai ritmar a minha vida. Sou fiel sou Gavião. Vai disparar meu coração. Com o balanço da torcida.
Desperto devagar sem muita pressa. O céu está azul é dia de verão. Meu tempo ainda meço com areia. É maré cheia vou correndo pra estação. Porque está na hora de pegar o trem. Ver o que a baiana tem. Desfilando na avenida. Também de me engrenar com alguém. Que me chame de meu bem. Para chamá-la de querida. Atrás do tempo lá vou eu. A vida não pode parar.
Brincar sorrir cantar. Dançar com as horas. Em qualquer lugar.
É que o relógio que atrasa. Não adianta. A galera está agitada. E se levanta. E o gol que estava preso. Sai da garganta. É hora de comemorar."
Gaviões da Fiel;Samba-Enredo;1992;;"[Enredo: Cidade Aquariana.
Norte, sul, leste, oeste. Faço meu sinal da cruz. A imagem de São Jorge me ilumina. E enche os Gaviões de luz.
Da paixão. Pela magia me fiz aprendiz. Consulto os astros para ser feliz. Nesta São Paulo Aquariana. De andar. Já me cansei cadê a condução?. Trabalho estudo. Num lugar fora de mão. Um dia quero ser bacana. Pra poder sambar. Cair na zoeira. E depois do carnaval. Lavar tudo que é mal na cachoeira.
Defender o meu arroz. Educar uma criança. Para não prender depois.
Li a mão, com a cigana. Simpatia, salve a baiana. E o meu gol carregado de emoção. Dedico a nação Corinthiana."
