escola;genero;ano;enredo;letra
Inocentes de Belford Roxo;Samba Enredo;2014;;"Maria mineira. Hoje os tambores anunciam. Tão belas notas que me guiam. Da pioneira voz de um lugar. Herança lições culturais. Viajam com seus ancestrais. Liberta a luz da razão em cordas vocais. Reluz feito oração. Um esplendor, a sua música. Unindo o piano ao tambor. Forjando um futuro de paz. A margem que se revelou. O encanto se faz.
Desfrutando talento, venceu preconceito. Cobrou seu direito, superou desafio. Seguiu seu destino, mostrando ao mundo. O valor de uma mulher (aplaudida de pé).
Concerto da lança e a lira. Conserto o meu conceito de inspiração. A voz de Joaquina sai de Vila Rica. E ganha o mundo então. Lisboa aplaudiu o sonho brilhou. O príncipe ouviu a notícia ecoou. Oh! Negra mulher. Talento vence o preconceito quem diria. É inocente a magia no ritual de louvação. Na ópera do povo eu quero ser feliz de novo. O seu triunfo agora no meu coração.
Mulata da Lapa sua voz encantou. Meu samba é uma linda sinfonia. Bateria tocou na cidade do amor. Esse é o tom que contagia."
;;;;
Jacarezinho;Samba Enredo;1970;;"O circo chegou aqui. Vamos aplaudir. Veio lá do estrangeiro. Para o nosso solo brasileiro.
Trazendo alegria a milhões de corações. Faz vibrar as multidões. Lalaia lalaia laia laia laia laia.
O circo é tradição mundial. E o palhaço é a figura principal. Os trapezistas sensacionais. Os domadores desafiam os animais. E no século xx. Despontaram para a platéia brasileira. O famoso chimarrão. Dudu e benjamim de oliveira.
Sorria, meu povo sorria. Com fred, carequinha e arrelia. Lá, lá, lá, lá."
Jacarezinho;Samba-Enredo;2019;;"Hoje dobro o rum em resistência. Brado n'aldeia, o meu canto tem valor. Sou de um povo que não teme as mazelas. Odara negritude da favela!.
Iyá, tira o teu filho da senzala. Iyá, coroa teu menino no congá. Dá alimento a quem viveu no cativeiro. Retira todos sonhos do fogão.
Nzungu, a liberdade nas bancadas. Ingrediente para Ilê, morada.
Iyó, à beira do cais, o fundamento. De Orí, superior, ensinamento. Canta, pra vencer o mal. Dança, pra afastar a dor. Bate cabeça quando toca o adjá. Dagô, dagô.
Ìran, sentinela, luta contra opressão. Bota Ipá em Nzungu, prevalece a união.
Dos que ainda travam batalhas. Não se curvam à chibata. Nem se contentam com a miséria na favela. Dos que nas veias corre sangue quilombola. E que, da Pedra, fizeram do samba uma escola. Axé, Jacarezinho, em busca da vitória."
;;;;
Ki Fogo;Samba-Enredo;2019;;"A emoção toma conta de mim. Pra falar do meu bem querer. Eu sei que vou te amar. Como Zé do pandeiro te amou. E vou me ajoelhar. Aos pés da mangueira fazer meu clamor. Ki fogo, hoje a saudade me devora. Nossos duetos nãose encontram como outrora. Meu coração seguindo solo. Me faz recordar. O gás que embalavam os refrões. A fonte das inspirações. Que levam a alma e fazem o povo cantar.
Lalalaia vou cantando na avenida. Lalalaia deixa quem quiser falar. É loucura, paixão desmedida. A razão da minha vida é te ver passar.
Tão linda embalando as multidões. No passo e no compasso. Me faz sonhar. Pra sempre hei de ser teu guardião. Mas quando a idade alertar. Que uma só nota, já nos sufoca. É preciso renovar. Abrir as cortinas de novo. Pra chama não se apagar.
Ki fogo é esse. Que me faz renascer?. Ki fogo é esse?. É Luz pro meu viver. Teu samba não pode parar. O show tem que continuar."
Lavapés;Samba-Enredo;2017;;"É luta é raça, é religião!. 80 anos de tradição!. Lavapés, resistência do samba. Com muito axé e gente bamba.
Um canto na Liberdade ecoou, ooh. Salve a Negritude altaneira. Protetora da bandeira. Que Madrinha Eunice abençoou. Rainha que nasceu no interior. Legítima herdeira do tambor!. Fez seu ninho nessa Capital. Mudando os rumos do carnaval!.
Pirapora, ê Pirapora!. O batuque anunciou, chegou a hora!. Ponteia Chico, faz o cavaco chorar. Que festa do bom Jesus. Vai até o sol raiar!.
Gira baiana, deixa falar. Vermelho e Branco é paixão. De um lindo sonho nasceu meu Pavilhão. E foram tantos frutos e glórias. Formando baluartes imortais. Na passarela fez do samba um artista. É a primeira no coração do sambista!. Nossa história se resume assim. Lavapés teve começo mas não terá fim!."
Leandro de Itaquera;Samba Enredo;2015;;"No rufar do tambor ôôô. O Alvorecer, na passarela. Exaltamos em vermelho e branco. Você, Mandela.
África!. De etnias fascinantes. Ouro e pedras preciosas. Despertaram a ambição. Deuses regentes da vida. Contra a dominação. Iluminado, nasce o filho destemido. E por eles protegido. Sua vida é lutar. Com peito cheio de esperança. Para a vitória alcançar.
Axé!!! Madiba axé!. Vem à corte festejar. Sou Leandro de Itaquera. O meu pavilhão vai triunfar.
Resistiu. Preservando a união. Plantando a paz e o amor. Com o poder da educação. Um grito forte ecoou. Libertem Nelson Mandela. Pra vencer o apartheid. Abre a jaula e solte a fera!. Você foi um líder, ícone da paz. Invencível na busca. Por seus ideais. Meu leão vem mostrar. Nesse carnaval. A luta de um povo guerreiro. Pela igualdade racial."
;;;;
Leandro De Itaquera;Samba-Enredo;2004;;"Leandro De Itaquera - Samba-Enredo 2004  . Enredo: São Paulo 450 Anos no Palco da Cultura, Que. Artista Sou Eu .
. Segura a Zona Leste vem aí. As cortinas vão se abrir, que felicidade. A vermelho e branco vem de novo. Homenageando o povo. Quem fez nascer, crescer esta cidade. Babel de ilusões, de mil atrações. São Paulo de lutas e conquistas. Festejar, vamos cantar. O show vai começar .
A força, a cultura, o negro é arte (ô, ô). O bravo imigrante, fiel sonhador, que idealizou. Gigante de pedra, que encanta e seduz é muita emoção. Meu samba é raça e vem nas garras do leão .
Vem ver toda influência. Que deu existência ao nosso viver. Levanta, sai do anonimato. A vida é um teatro é cinema e TV. Pintores, escultores, escritores geniais. Na musicalidade salve Sampa é demais. Vem ser o artesão. Criar poesias, criar pra viver. Viver pra sonhar buscando crescer .
Pra alcançar o estrelato e vencer. Pois nesse palco o artista é você .
Quem sou eu? Quem eu sou?. Paulistano e guerreiro, sou Leandro, meu amor.."
Leandro De Itaquera;Samba-Enredo;2005;;"Leandro de itaquera - samba-enredo 2005. Rotary - dar de si antes de pensar em si, o carnaval. Das emoções.
Fragmentos da proposta de enredo:.
A vida iluminada deus nos deu. A natureza, a terra a água e o ar. Nos deu calor para pulsar os corações. E muitas sementes para a terra semear.
Pedras preciosas abrilhantando o nosso chão. O homem sem rumos descobre a sua ambição. O ouro e o seu falso poder. Quanto mais tem, mais deseja ter. A cobiça faz a humanidade se perder.
E o poder da ciencia. Patrocinada pelos donos do ouro. Alcança sonhos inimagináveis. Mas ofusca o valor da vida. E num juízo final, o que deverá restar?.
Numa guerra de desespero, o cientista diz:.
- o culpado é você. Que por tanto ouro, tantas vidas destruiu. Que por tanto poder, tantos valores comprou. Pensou que era o dono da terra. Um livro emprestado, que você não cuidou.
O poderoso diz:.
- o culpado é você. Que o infinito descobriu. A clonagem inventou. Mas esqueceu de mapear o caminho do amor.
Não fosse os guardiões do centenário. Essa guerra iría muito longe. Não fosse esses homens sonhadores. De reais valores. A paz estaría muito mais distante.
Rotarianos e rotaractianos, homens de bem. Voluntários servindo a humanidade. Dar de sí, antes de pensar em si. Operários da justiça, reciclando o mundo. Rotativamente resgatando a felicidade. Respeitando a vida. Educando o cidadão. E a família como base de um bem comum. Salvando as diferenças necessitadas. E dando asas a uma bela juventude. Que radicalmente, age por um mundo melhor. Sem drogas e com mais esportes.
Venha sonhar também. Venha acordar com a leandro de itaquera. Amanhecer no carnaval das emoções. Ajude quem precisa. Seja voluntário para a felicidade de alguém. Procure uma ong também. Faça o seu papel na sociedade. Não deixe a tristeza vencer. Participe do nosso carnaval do centenário. Com pierrots, arlequins e colombinas. Na folia da paz. Tenha a fé pois o sol vai brilhar. E o nosso futuro muito melhor será.
Vamos perdoar nossos irmãos. Um novo tempo sempre há de surgir. Depende de cada coração. Do verdadeiro amor. Dar de si."
Leandro de Itaquera;Samba-enredo;2006;;"Vou navegar por esse rio de fantasias. Desfilar na passarágua, que espendor. Nesse tom vermelho-e-branco. Me leva, me leva nesse barco de amor.
Flutuei por entre festas, tradições. Desfilando emoções. São Paulo emoldurando sua raiz. Sobre as águas de um novo Tietê. Vejo a barra mais bonita e o porto mais feliz. Pirapora Bom Jesus, o milagreiro. Desse povo tão guerreiro. Que traz fé no coração. Que iluminou águas passadas. Navegadas pelos desbravadores do sertão.
É no toque da viola sertanejo faz festança. Na congada o negro dança para seu rei coroar. Na Praia Grande Odoiá mamãe sereia. Mamãe Oxum não deixa meu barco virar.
Holambra traz pureza em suas flores. Com suas cores e fragrâncias sensuais. As frutas também têm o seu circuito. Que é tão bonito, com sabores naturais. Campos de Jordão é tradição,. Em qualquer das estações. O seu clima é ideal. E a Leandro de Itaquera contagia. Dando um banho de alegria,. Desaguando neste pólo cultural."
;;;;
Leão de Nova Iguaçu;Samba Enredo;2015;;"Sou negro, sou forte. E peço respeito.. Sou leão iguaçuano. E quem é bate no peito.. Com a força de zumbi. E a raça de mandella. A minha escola vem cantar na passarela.
Voar e renascer das cinzas,. Meu pernambuco vem apresentar:. Zumbi, o rei dos palmares.. E na senzala o negro a clamar.. Tem festa em noite de lua cheia,. Felicidade paira no ar.
No ventre da serra nasceu o menino. Heróico destino surge a miscigenação. O homem branco pediu a paz. Ganga zumba:. Liberdade, guerra nunca mais!. Zumbi disse não!. Liderou a batalha... Redenção. Velho jorge é chamado,. O quilombo tomado... Invasão.
Em dia de carnaval. A guerra se iniciou. Ee nosso herói se imortalizou. Pai da pátria,. Pregador da paz. Nunca se deixou escravizar.
Exemplo que orgulha uma nação. Eu sou o capitão o capitão da minha alma.. Com fé venceu a luta e o mundo aplaudiu.. De branco, amarelo, vermelho. Eu vou!. Mandella mostra o seu valor!."
Leão de Nova Iguaçú;Samba-Enredo;2018;;"O espelho reflete a minha beleza. Sou a vaidade buscando a perfeição. A obra mais bela da Mãe Natureza. Sou Leão.
O espelho reflete a minha beleza. Sou a vaidade buscando a perfeição. A obra mais bela da Mãe Natureza. Sou Leão.
Viajei. Na mitologia me inspirei. Me encantei com Afrodite. Deus Apolo, me permite!. Narcisista, sou um rei.
Da pré-história. Vem a herança da cultura corporal. Poesia. Estampada com areia e vegetal. O antigo Egito inspirou. A vaidade no ato de se banhar. Aos deuses, o respeito em cada olhar. Na Grécia. A beleza toma forma escultural. Mas a luz da igreja era pecado. Reluz o Renascimento. Da mão do artista, o belo é retratado.
O índio bate o seu tambor, tem ritual. A pintura em seu corpo é divinal. Vestimenta do seu dia a dia. É fantasia pra brincar o carnaval.
O índio bate o seu tambor, tem ritual. A pintura em seu corpo é divinal. Vestimenta do seu dia a dia. É fantasia pra brincar o carnaval.
A madrasta má. Cuidado, ela vai te enfeitiçar. Mamãe trabalha o dia inteiro. Mas não deixa de se embelezar. Esbanjando melanina. Samba, menina. Black, dread ou chanel. Olha que bumbum arrebitado. Peito siliconizado. Cada um escolhe o seu papel.
Oh, minha Nova Iguaçu!. Paraíso industrial. Com a cara da riqueza. Sou Leão, estou na moda. Vou bombar na rede social.
O espelho reflete a minha beleza. Sou a vaidade buscando a perfeição. A obra mais bela da Mãe Natureza. Sou Leão.
O espelho reflete a minha beleza. Sou a vaidade buscando a perfeição. A obra mais bela da Mãe Natureza. Sou Leão."
Lins Imperial;Samba-Enredo;2019;;"Do morro, eu contemplo a cidade. A janela emoldura a poesia. Numa aquarela onde a brava resistência. É a luz da consciência. No alvorecer de um novo dia.
Vou descendo a ladeira. Vejo a vida ao inverso. Partideiros zombam da verdade em verso. Malandragem verdadeira. Faz do dissabor a inspiração.
Seu doutor. É no samba que eu exponho as mazelas. A realidade da favela. Promessas do político caô (caô).
A discriminação a sogra o vacilão. Semente que ninguém plantou.
Na cabeça o flagrante é a melodia. Não me julgue, pois eu sou homem de paz. A essa gente transmito alegria. Legado que não se desfaz. E assim transformo em verbo. A mão que ilumina o compositor. No barro na colina e no asfalto. O partido alto me fez vencedor.
Sou Bezerra da Silva malandro exemplar. A voz do meu povo ninguém vai calar. Num gesto de amor e igualdade social. Canta Lins Imperial."
Lira da Minerva;Samba Enredo;2012;;"Vem minerva,. Me leva pra cantina do joão. Me faz lembrar do samba exaltação. Eu sou da lira, tricolor de coração.
A lira já vai passar. Chegou para cantar com emoção. Trazendo em sua melodia. A simplicidade de joão. Para falar do dia a dia. De amizade e simpatia. De um sujeito especial. Peço licença à saudade. Pois hoje a felicidade. Faz do seu sorriso carnaval.
Na cantina encontrava amigos de fé. Era lá que eu deixava o meu violão. Entre um gole e outro de café. É que rolava a batucada no balcão.
Histórias que fizeram sorrir,. Que fizeram chorar,. Me ajudaram a crescer. Hoje a lira presta essa homenagem. Mais uma vez pede passagem. Vem com alegria reviver. Momentos que o tempo guardou. E que jamais vou esquecer."
Los Amantes de Atalaya;Samba Enredo;2015;;"Suena un tambor y alegra mi corazón. Comienza el show al son de la percusión. Esta Batería no se calla, a donde vaya. Soy Amante de Atalaya!.
Acrobacias, malabares y piruetas. Payasadas, alocadas morisquetas. En una explosión de color que busca erradicar el dolor. Procurar tu alegría, en el día a día. ese es mi canto al amor.
Llegó el circo al compás del carnaval. El pueblo está de fiesta, voy a festejar!. Mi samba y tu risa voy a combinar. En un cóctel de alegría sin igual.
Atención, que pienso robarte una sonrisa. Divertirte, siempre será nuestra premisa. Hoy te invito a descubrir y compartir. Nuestra cultura, nuestra forma de vivir. Canta Atalaya segura!. Y de mi familia traigo arraigada la tradición. Mística de un mundo de carcajadas y de ilusión. Quince años van ya de caravana. De manera gitana, viajando sin cesar. Culminar entre aplausos mi conquista. De mi suerte soy artista, mi escenario el Carnaval."
Magnólia Brasil;Samba-Enredo;2019;;"Vou com a minha corte amor. Vem comigo viajar. Paraíso tão bonito. Estou seguindo meu caminho. O destino é Cuiabá.
Toca a viola de cocho, de mocho e ganzá. Pelo portal do pantanal eu vou entrar. Sentindo a verde cidade o colorido da vida. O esplendor da tradição admirar. Chique na chita enfeitada no seu chitão. Morena linda, latina de coração. Voa no lindo bailar do colibri. Embala o samba no passo do siriri.
Salve a terra do amor, terra do ouro. Que chovam bênçãos do céu, alumia seu povo. Arrasta a sandália, levanta a poeira. A magnólia não é brincadeira!.
Brilhante e preciosa é sua gente. Traz na alma essa cultura diferente. Com fé no sonho de felicidade. E devoção ao padroeiro da bondade. É grande a saudade, voltei ao meu lar. Sorriso estampado no olhar. No carnaval, festejar sua história. 300 anos vivos na memória."
Mancha Verde (Juventude);Samba-Enredo;2015;;"O criador a existência ofertou. A mancha verde é amor, a essência da paixão. Saudade com gosto de felicidade e emoção. Lembranças no meu coração.
O criador a existência ofertou. A mancha verde é amor, a essência da paixão. Saudade com gosto de felicidade e emoção. Lembranças no meu coração.
Oh, mãe, a vida gerar. O pai ensinando a caminhar. Olhos ao céu, mente pronta a aprender. Nos sentidos, a sede de viver. Memória, um sublime relicário. O batizado, o primeiro aniversário. Jogos, brincadeiras, aprender o beabá. Da professora, dos colegas recordar. E as delícias da vovó provar.
Vem viajar, lembrar amores e amizades. Sentimentos que ficaram na saudade. Vem viajar com a verde e branco sambar. E a puro swing delirar.
Vem viajar, lembrar amores e amizades. Sentimentos que ficaram na saudade. Vem viajar com a verde e branco sambar. E a puro swing delirar.
O tempo passou, cresci. Aborrecente e rock’n'roll. Tive game, meu skate. No fone o som. Minha juventude, só diversão. De repente acordei, me tornei um cidadão. CPF, RG, vou trabalhar. Pensei que ser adulto era apenas o salário ganhar. Formado vou fazer a minha trajetória. Casar, ter filhos, escrever novas histórias. Transmitir as minhas lembranças, dos tempos de criança. Eternizar em poesia o livro do meu ser. As saudades que adoro ter."
Mancha Verde;Samba Enredo;2011;;"É verde o sangue que corre na veia. Mancha, eterna guerreira.. Uma ideia genial. Brilhando nesse carnaval!.
Verdadeiro orgulho de um povo. Derramo sobre a noite a luz do dia. Desperto o universo com um sopro de amor. Sou eu o criador de toda a vida. O homem fiz surgir. Evoluir em novidades geniais. Eureca!! Encontrei a explicação. Com o poder de mudar,. Imprimi meu caminhar. Orientei caminhos, contei cada segundo. No renascimento eu fui inspiração. Para o maior gênio do mundo.
Vem que eu faço se mover. E trago o mundo até você. Vem voar, sonhar. Brincar de Deus, poder curar. Na energia que faz clarear..
Descrevi um grande amor. Modelei, fiz encantar. Se pintei também a dor. Mil notas musicais eu projetei no ar. Arte ou loucura o que será?. Ser surreal... Poder inventar. Um mundo sem ódio e rancor. Onde o maior valor seja se expressar. Larguem minha fantasia eu quero sambar. Na felicidade de um novo amanhã. Um grito ecoou: É campeão!!!."
Mancha Verde;Samba Enredo;2012;;"É hora de reconhecer. A humildade é a voz da razão. Sou Mancha Verde guerreira, erguendo a bandeira. Aceitando a missão.
A fé eu fui buscar. Com meu clamor ao mensageiro. Sou Babalorixá. A dor de um mundo inteiro. Tenho a sede do saber. E ainda há muito o que aprender. Se Olorun é o pai na criação. Eu sou mais um dos filhos desse chão. Orunmilá criou senhores do destino. A cada irmão deu seu ensino. O dom em conhecer as direções.
O olhar de cobiça vai perceber Babalaô. Faz a justiça vencer meu pai Xangô. A simplicidade vai determinar. A riqueza na lição de Obará.
Vem preservar. Respeitar a natureza do criador. Os orixás são provas do seu amor. Que os ventos de Iansã. Levem Oxum, Obá, Nanã. No encontro com o mar, a vida é linda ,salve Oxalá. Sementes vão trazer às folhas o poder. É o fim de uma era que se regenera em Obaluae. Oh senhor,perdoai a humanidade, iluminai a consciência. Pra guiar essa mudança. Vou guardar no coração, levar em minhas mãos. A mensagem de esperança."
Mancha Verde;Samba Oficial;2015;;"De braços abertos vou me declarar. Eu amo você palmeiras. 100 Anos de lutas e de glórias. Canta mancha verde guerreira.
Nem sei por onde começar. De tanto amar, seu manto sagrado. Eu vivo suas emoções. Mil declarações refletem meus atos. Em solo brasileiro. Dos povos o mais guerreiro. Da mitologia a inspiração. Herança marcada na evolução. No “parque” um sonho a conquistar. Em cada coração o nosso lar.
Olê palestra!. Com raça venceu a perseguição. Olê palmeiras!. De fato o eterno campeão.
Heroico!. No ardor da partida, ostentou sua fibra. Com as cores do meu brasil. Brilham na academia. Estrelas num lindo “jardim”. “Divino” a luz que me guia, um amor sem fim. Sagradas na mão de um santo minha devoção. “Liberto” o grito eu sou campeão. Em verde e branco quero eternizar. A nova casa, meu orgulho, meu lugar."
;;;;
;;;;
Mancha Verde;Samba-Enredo;2010;;"Eu bato no peito. Sou Mancha Verde até morrer. Aos mestres com carinho, vou cantar. Em Verde e Branco, eternizar.
É mais do que educação (Mancha). Guerreira, traduz o ensino em emoção. Transforma a história em fantasia. Representando a arte que inspira. A contemplar na Grécia a fonte do saber. Traçando assim a identidade para o meu viver. Seguindo os caminhos da vida busquei. Na China, o segredo da alma encontrei. A mente e o corpo a equilibrar. Sagrada cultura milenar. Vi caravelas cruzando mares, continentes. Trazendo ao dono desta terra, a devoção.
Pajé, pajé. Na beira da mata dançou, ôôô. A sua cultura ensinou, encantou. A força da fé, para catequizar. O jesuíta trouxe de além mar.
Numa folha qualquer. Escreve a arte que me faz sonhar. Mesmo perseguido, oprimido. Não se deixou calar!. Em meu Brasil, gigante menino, trilhou seu destino. Se renovando com a era digital. Aplausos aos mestres do samba. Docentes da escola de bambas. Me fez assim, orgulho do país. Estrela-mãe que me guia, norma da sabedoria. Sou eterno aprendiz. Puro balanço, samba de raiz."
Mancha Verde;Samba-Enredo;2017;;"Bate em meu peito a emoção. É verde e branco o meu amor. Orgulho e paixão. Nos braço da multidão. O samba reconhece o meu valor.
No puro balanço do tambor, é Zé Pereira. Canto em brado a homenagem aos Josés (Mancha Guerreira). Do milagre à devoção, a fé, religião. Aos romeiros eu sou padroeiro e a salvação. O dom de curar em minhas mãos. Na voz um doce cantar. Fiz da Vila, cidade. Vindo de além mar. Eu sou a história. Tenho muito pra te contar.
Êêê, o meu nome é expressão popular. Êêa, o clamor a liberdade. Imortal. Capoeira, capoeira.
Valei-me, valei, sou arte. Cabra da peste sonhador. Malandro guerreiro, felomenal. Ao som da Tropicália dei o tom. Personagens criei. O terror em cartaz. Roda Viva em cena. Eu sou a face da grandeza desse povo. A metamorfose dessa pátria mãe gentil. Muito prazer, Zé do Brasil!."
Mancha Verde;Samba-Enredo;2019;;"[Enredo: Oxalá, Salve a Princesa! A Saga de Uma Guerreira Negra.
Tambores vão ecoar, a festa vai começar. O meu batuque traz a força do terreiro. A mancha verde é kizomba, amor. Salve a princesa! Viva o povo negro!.
Tambores vão ecoar, a festa vai começar. O meu batuque traz a força do terreiro. A mancha verde é kizomba, amor. Salve a princesa! Viva o povo negro!.
O ora ie ie ô ora ie ieu mamãe Oxum. Um ventre de luz, o fruto do amor. Kaô kabecilê Xangô. África, suntuosa riqueza. África, reluz o encanto e a nobreza.
A fé conduz o Congo a lutar. Tristeza marejou meu olhar. Oh Senhor, tem piedade. Dos corações sem liberdade.
A alma que chora, a pele que sangra. Qual será o meu valor?. Entrego minha vida. Rainha do mar, Iemanjá.
A alma que chora, a pele que sangra. Qual será o meu valor?. Entrego minha vida. Rainha do mar, Iemanjá.
Aportei, na terra do Sol e do maracatu. Vidas no suspiro derradeiro. Na fria solidão do cativeiro. Mãos calejadas a lavourar. Não perdi a fé nos Orixás.
Senhora do Rosário, oh, Nossa Senhora. Aos pés do seu altar, clamo a igualdade. Palmares, vi um céu de luz e liberdade. A força de Zumbi a nos guiar. Nas bênçãos de Oxalá."
Mangueira;Samba Enredo;1951;;"Unidade nacional.
Glória a unidade nacional. Portentosa e altaneira. Genuína, brasileira e primordial. Vinte e um estados reunidos. Todos no mesmo sentido. Dando a sua produção. É fator de nossa economia. Dar uma prova cabal. Da nossa democracia. A nossa política é altiva. Irmanada e progressiva. Produtiva e social. Pela grandeza da pátria coordenamos. Todos com o mesmo ideal. É o fator de equidade. Trabalhando com vontade. Para o progresso nacional.
Tudo isso é o meu brasil. Isso é um orgulho. De um povo forte, esbelto e varonil. Lá, lá...."
Mangueira;Samba Enredo;1952;;"Gonçalves dias.
Louvores e honra ao mérito. A memória de um poeta. De sublime inspiração. Seus poemas são tão lindos. Que faz vibrar o coração. Vamos elevar aos píncaros da glória. O nome de gonçalves dias. Autor de inúmeros poemas. Que glorificaram as nossas poesias.
Nosso céu tem mais estrelas. De belezas deslumbrantes. Nossas matas têm mais cores. Tão belas e verdejantes. Nossas flores têm mais vida. Pela própria natureza. Que em vazos mudam de cores.
Que elevam nossas almas. Nossas vidas mais amores. Lá, lá, laia, laia.."
Mangueira;Samba Enredo;1954;;"Rio de janeiro, de ontem e de hoje.
Rio de janeiro. Cidade tradicional. Dos tempos das sinhás moça,. Mucamas e nobres damas. E da corte imperial. Teu panorama suntuoso,. Primoroso, sublime, vibrátil. É s a cidade modelo. O coração do brasil. O rio da nova era. Prima por sua desenvoltura. É tão soberbo. O seu progresso. É um primor. A sua arquitetura.
Apologia a estácio de sá. Que da cidade foi o fundador. Prefeito pereira passos. Pioneiro e remodelador. Paulo de frontin hábil engenheiro. Símbolo de abnegação. Pedro ernesto, e outros governantes. Deram ao rio grande evolução."
Mangueira;Samba Enredo;1955;;"As quatro estações do ano.
Brilha no céu o astro-rei. Com fulguração. Abrasando a terra. Anunciando o verão. Outono. Estação singela e pura. É a pujança da natura. Dando frutos em profusão. Inverno. Chuva, geada e garoa. Molhando a terra. Preciosa e tão boa. Desponta. A primavera triunfal. São as estações do ano. Num desfile magistral. A primavera. Matizada e viçosa. Pontilhada de amores. Engalanada, majestosa. Desabrocham as flores. Nos campos,. Nos jardins e nos quintais. A primavera. É a estação dos vegetais.
Oh! primavera adorada. Inspiradora de amores. Oh! primavera idolatrada. Sublime estação das flores."
