escola;genero;ano;enredo;letra
Mangueira;Samba-Enredo;2019;;"[Enredo: História pra Ninar Gente Grande.
Mangueira, tira a poeira dos porões. Ô, abre alas pros teus heróis de barracões. Dos Brasis que se faz um país de Lecis, jamelões. São verde e rosa, as multidões.
Mangueira, tira a poeira dos porões. Ô, abre alas pros teus heróis de barracões. Dos Brasis que se faz um país de Lecis, jamelões. São verde e rosa, as multidões.
Brasil, meu nego. Deixa eu te contar. A história que a história não conta. O avesso do mesmo lugar. Na luta é que a gente se encontra.
Brasil, meu dengo. A Mangueira chegou. Com versos que o livro apagou. Desde 1500 tem mais invasão do que descobrimento. Tem sangue retinto pisado. Atrás do herói emoldurado. Mulheres, tamoios, mulatos. Eu quero um país que não está no retrato.
Brasil, o teu nome é Dandara. E a tua cara é de cariri. Não veio do céu. Nem das mãos de Isabel. A liberdade é um dragão no mar de Aracati.
Salve os caboclos de julho. Quem foi de aço nos anos de chumbo. Brasil, chegou a vez. De ouvir as Marias, Mahins, Marielles, malês."
Portela;Samba-Enredo;2019;;"[Enredo: Na Madureira Moderníssima, Hei Sempre de Ouvir Cantar Uma Sabiá.
Axé, sou eu. Mestiça, morena de Angola, sou eu. No palco, no meio da rua, sou eu. Mineira, faceira, sereia a cantar, deixa serenar. Que o mar de Oswaldo Cruz a Madureira. Mareia a brasilidade do meu lugar. Nos versos de um cantador. O canto das raças a me chamar. De pé descalço no templo do samba estou. É rosa, é renda pra Águia se enfeitar. Folia, furdunço, ijexá. Na festa de Ogum beira-mar. É ponto firmado pros meus orixás, Eparrei!.
Eparrei Oyá, Eparrei. Sopra o vento, me faz sonhar. Deixa o povo se emocionar. Sua filha voltou, minha mãe.
Eparrei Oyá, Eparrei. Sopra o vento, me faz sonhar. Deixa o povo se emocionar. Sua filha voltou, minha mãe.
Pra ver a Portela tão querida. E ficar feliz da vida. Quando a Velha Guarda passar. A negritude aguerrida em procissão. Mais uma vez deixei levar meu coração. A Paulo, meu professor. Natal, nosso guardião. Candeia que ilumina o meu caminhar. Voltei à Avenida saudosista. Pro Azul e Branco modernista eternizar. Voltei, fiz um pedido à Padroeira. Nas Cinzas desta Quarta-feira, comemorar.
Nossas estrelas no céu estão em festa. Lá vem Portela com as bênçãos de Oxalá. No canto de um Sabiá, sambando até de manhã. Sou Clara Guerreira, a filha de Ogum com Iansã.
Nossas estrelas no céu estão em festa. Lá vem Portela com as bênçãos de Oxalá. No canto de um Sabiá, sambando até de manhã. Sou Clara Guerreira, a filha de Ogum com Iansã."
Mancha Verde;Samba-Enredo;2019;;"[Enredo: Oxalá, Salve a Princesa! A Saga de Uma Guerreira Negra.
Tambores vão ecoar, a festa vai começar. O meu batuque traz a força do terreiro. A mancha verde é kizomba, amor. Salve a princesa! Viva o povo negro!.
Tambores vão ecoar, a festa vai começar. O meu batuque traz a força do terreiro. A mancha verde é kizomba, amor. Salve a princesa! Viva o povo negro!.
O ora ie ie ô ora ie ieu mamãe Oxum. Um ventre de luz, o fruto do amor. Kaô kabecilê Xangô. África, suntuosa riqueza. África, reluz o encanto e a nobreza.
A fé conduz o Congo a lutar. Tristeza marejou meu olhar. Oh Senhor, tem piedade. Dos corações sem liberdade.
A alma que chora, a pele que sangra. Qual será o meu valor?. Entrego minha vida. Rainha do mar, Iemanjá.
A alma que chora, a pele que sangra. Qual será o meu valor?. Entrego minha vida. Rainha do mar, Iemanjá.
Aportei, na terra do Sol e do maracatu. Vidas no suspiro derradeiro. Na fria solidão do cativeiro. Mãos calejadas a lavourar. Não perdi a fé nos Orixás.
Senhora do Rosário, oh, Nossa Senhora. Aos pés do seu altar, clamo a igualdade. Palmares, vi um céu de luz e liberdade. A força de Zumbi a nos guiar. Nas bênçãos de Oxalá."
Unidos da Tijuca;Samba-Enredo;2019;;"[Enredo: Cada Macaco No Seu Galho. Ó, Meu Pai, Me Dê o Pão Que Eu Não Morro de Fome!.
Hoje a Tijuca pede em oração. Veste a fantasia pra fazer o bem. Multiplica o sagrado pão. Amém (amém).
Meu filho. Como é lindo o amanhecer. Reflete o Sol, a criação. Um bom dia a renascer. Pelos olhos do pavão. Sou a fé na vida. Esperança da massa. Aquele que na dor te abraça. Sou eu, a verdade pra quem pede luz. Carregando a sua cruz. O alimento em comunhão. Princípio da salvação.
Ouço chamar meu nome. Ouço um clamor de prece. Choro ao te ver com fome. Sou o cordeiro que a alma fortalece.
Só existe um caminho (por favor). Cada um faz seu destino (meu senhor). As migalhas do poder que o diabo amassou. Estão dentro de você. As mãos unidas vem pedindo o perdão. Gente sofrida com a paz no coração. Dividem o pouco que tem pra comer. Dividem o pouco que tem pra comer.
Ó, meu pai, o seu amor é a receita. Iluminai, que não me falte o pão na mesa. Derrame igualdade, prosperidade. As bênçãos do céu. Se Deus é por nós, escute a voz. Que vem do meu Borel.
Hoje a Tijuca pede em oração. Veste a fantasia pra fazer o bem. Multiplica o sagrado pão. Amém (amém)."
Vila Isabel;Samba-Enredo;2019;;"[Enredo: Em Nome do Pai, do Filho e dos Santos, a Vila Canta a Cidade de Pedro.
Viva a princesa e o tambor que não se cala. É o canto do povo mais fiel. Ecoa meu samba no alto da serra. Na passarela, os herdeiros de Isabel.
Viva a princesa e o tambor que não se cala. É o canto do povo mais fiel. Ecoa meu samba no alto da serra. Na passarela, os herdeiros de Isabel.
Vila, te empresto meu nome. Fonte de tanta nobreza. Por Deus e todos os santos. Honre a tua grandeza. E subindo, pertinho do céu. A névoa formava um véu. Lembrei de meu pai, minha fortaleza. Esculpida em pedras, pedros e coroados. Os seus guardiões, protetores de raro esplendor. Luar do imperador.
Meu olhar lacrimejou. Em águas tão cristalinas. Uma cidade divina. Bordada em nobre metal, a joia imperial.
Meu olhar lacrimejou. Em águas tão cristalinas. Uma cidade divina. Bordada em nobre metal, a joia imperial.
Petrópolis nasce com ar de Versalhes. Adorna a imensidão. A luz assentou o dormente. Fez incandescente a imigração. No baile de cristal, o tom foi redentor. Em noite imortal, floresceu um novo dia. Liberdade, enfim, raiou.
Não vi a sorte voar ao sabor do cassino. Segundo o dom que teceu o destino. Meu sangue azul no branco desse pavilhão. O morro desce em prova de amor. Encontro da gratidão.
Viva a princesa e o tambor que não se cala. É o canto do povo mais fiel. Ecoa meu samba no alto da serra. Na passarela, os herdeiros de Isabel.
Viva a princesa e o tambor que não se cala. É o canto do povo mais fiel. Ecoa meu samba no alto da serra. Na passarela, os herdeiros de Isabel."
Grande Rio;Samba-Enredo;2019;;"[Enredo: Quem Nunca? Que Atire a Primeira Pedra.
Tá errado, não importa quem errou. O pecado e o pecador. Sempre estão do mesmo lado. Tá errado, sem lição nem professor. Se o espinho fere a flor. O amor é maculado. No jeitinho que impera nessas bandas. É mais fácil o mau caminho pra jogar no tabuleiro. Na verdade do espelho. Quando a razão desanda. Vai seguindo em desalinho. Mesmo com o sinal vermelho.
Atire a primeira pedra aquele que não erra. Quem nunca se arrependeu do que fez. Na vida todo mundo escorrega. Melhor se machucar só uma vez.
Atire a primeira pedra aquele que não erra. Quem nunca se arrependeu do que fez. Na vida todo mundo escorrega. Melhor se machucar só uma vez.
Cardume de garrafas pelo mar. Nem tarrafa nem puça alimentam o pescador. E a cisma de atender o celular. Pra curtir, compartilhar. Zombar do perigo, largar o amigo, perder o pudor. Quem aí tá podendo julgar?. Não consegue ouvir outra voz. Cada um foi pensando em si. Olha o que fizemos de nós. Então pegue seu filho nas mãos. Educar é um desafio. Se errei peço perdão. Renasce a Grande Rio.
Quem nunca sorriu da desgraça alheia?. Quem nunca chorou de barriga cheia?. Eu sou Caxias de tantos carnavais. Falam de mim, eu falo de paz.
Quem nunca sorriu da desgraça alheia?. Quem nunca chorou de barriga cheia?. Eu sou Caxias de tantos carnavais. Falam de mim, eu falo de paz."
Gaviões da Fiel;Samba-Enredo;2019;;"[Enredo: A Saliva do Santo e o Veneno da Serpente.
Saravá, saravá. Salve o santo guerreiro. E uma vela pra saudar. Meu São Jorge Padroeiro. Saravá, saravá. Salve o santo guerreiro. E uma vela pra saudar. Meu São Jorge Padroeiro.
É, meu santo é forte. Não adianta me picar. Sou Gavião e você pode acreditar. Que não aceito traição. E o veneno da serpente. Eu transformo em semente. É o tabaco em plantação.
Erva santa curou dores. Seduziu com seus sabores. Café e rapé em Paris. A nobreza aspirava. E ficava mais feliz.
Vou, vou pra Bahia. Acende a chama. No terreiro de Iáiá. É a força da magia. Que me arrepia. E se espalha pelo ar.
Vou, vou pra Bahia. Acende a chama. No terreiro de Iáiá. É a força da magia. Que me arrepia. E se espalha pelo ar.
Saravá, saravá. Salve o santo guerreiro. E uma vela pra saudar. Meu São Jorge Padroeiro. Saravá, saravá. Salve o santo guerreiro. E uma vela pra saudar. Meu São Jorge Padroeiro.
Mulher, mulher, mulher. Quem te viu e quem te vê. O que embaça se perdeu, virou fumaça. Liberdade pra você.
É um raro prazer, sabor de emoção. Mas não abuse, que faz mal pro coração. É um raro prazer, sabor de emoção. Mas não abuse, que faz mal pro coração.
É, meu santo é forte. Não adianta me picar. Sou Gavião e você pode acreditar. Que não aceito traição. E o veneno da serpente. Eu transformo em semente. É o tabaco em plantação.
Erva santa curou dores. Seduziu com seus sabores. Café e rapé em Paris. A nobreza aspirava. E ficava mais feliz.
Vou, vou pra Bahia. Acende a chama. No terreiro de Iáiá. É a força da magia. Que me arrepia. E se espalha pelo ar.
Vou, vou pra Bahia. Acende a chama. No terreiro de Iáiá. É a força da magia. Que me arrepia. E se espalha pelo ar.
Saravá, saravá. Salve o santo guerreiro. E uma vela pra saudar. Meu São Jorge Padroeiro. Saravá, saravá. Salve o santo guerreiro. E uma vela pra saudar. Meu São Jorge Padroeiro.
Mulher, mulher, mulher. Quem te viu e quem te vê. O que embaça se perdeu, virou fumaça. Liberdade pra você.
É um raro prazer, sabor de emoção. Mas não abuse, que faz mal pro coração. É um raro prazer, sabor de emoção. Mas não abuse, que faz mal pro coração. Mas não abuse, que faz mal pro coração. Mas não abuse, que faz mal pro coração."
Unidos do Viradouro;Samba-Enredo;2019;;"Quem me viu chorar. Vai me ver sorrir. Pode acreditar, o amor está aqui. Viraviradouro iluminou. O brilho no olhar voltou.
Se tem magia, encanto no ar. Eu vou viajar ouvindo histórias. De um livro secreto. Mistérios sem fim. Vovó desperta a infância em mim. Em cada conto sou mais um menino. Que muda a sorte e sela o destino. Lançado o feitiço pra vida virar. Pro bem ou pro mal, é carnaval. E na fantasia. A minha alegria é um sonho real.
No reino da ilusão. O amor seduz o vilão. Num conto de fadas, a felicidade. Encanta o meu coração pra cantar. Deixando a tristeza do lado de lá.
E quem ousou desafiar a ira divina. Vagou no mar. Cego pela sede da ambição. Carregando a sina dessa maldição. Seres da sombria madrugada. O medo caminhou na escuridão. Mas a coragem que me faz lutar. É a esperança, razão de sonhar. Imaginar e renascer. No Sol de cada amanhecer. Das cinzas voltar. Nas cinzas vencer."
Salgueiro;Samba-Enredo;2019;;"[Enredo: Xangô.
Mora na pedreira, é a lei da Terra. Vem de Aruanda pra vencer a guerra. Eis o justiceiro da Nação Nagô. Samba corre gira, gira pra Xangô.
Mora na pedreira, é a lei da Terra. Vem de Aruanda pra vencer a guerra. Eis o justiceiro da Nação Nagô. Samba corre gira, gira pra Xangô.
Olori Xango eieô. Olori Xango eieô. Kabesilé, meu padroeiro. Traz a vitória pro meu Salgueiro.
Olori Xango eieô. Olori Xango eieô. Kabesilé, meu padroeiro. Traz a vitória pro meu Salgueiro.
Vai trovejar!. Abram caminhos pro grande Obá. É força, é poder, o Aláàfin de Oyó. Oba Ko so! Ao rei maior. É pedra quando a justiça pesa. O Alujá carrega a fúria do tambor. No vento, a sedução (Oyá). O verdadeiro amor (Oraiêiêô). E no sacrifício de Obà (Obà Xi Obà). Lá vem Salgueiro!.
Mora na pedreira, é a lei da Terra. Vem de Aruanda pra vencer a guerra. Eis o justiceiro da Nação Nagô. Samba corre gira, gira pra Xangô.
Mora na pedreira, é a lei da Terra. Vem de Aruanda pra vencer a guerra. Eis o justiceiro da Nação Nagô. Samba corre gira, gira pra Xangô.
Rito sagrado, ariaxé. Na igreja ou no candomblé. A bênção, meu Orixá!. É água pra benzer, fogueira pra queimar. Com seu oxê, chama pra purificar. Bahia, meus olhos ainda estão brilhando. Hoje marejados de saudade. Incorporados de felicidade. Fogo no gongá, salve o meu protetor. Canta pra saudar, Opanixé kaô!. Machado desce e o terreiro treme. Ojuobá! Quem não deve não teme."
Beija-Flor de Nilópolis;Samba-Enredo;2019;;"[Enredo: Quem Não Viu Vai Ver… As Fábulas do Beija-Flor.
Oh, deusa. Tem festa no meu coração. Desfilo toda gratidão. Razão do meu cantar, a luz do meu viver. O que seria de mim sem você?.
Oh, deusa. Tem festa no meu coração. Desfilo toda gratidão. Razão do meu cantar, a luz do meu viver. O que seria de mim sem você?.
Nascido feito o rei menino. Em ninho de amor e humildade. Meu pai direcionou o meu destino. Voar nas asas da felicidade.
E arrisquei um voo nesse lindo azul. Um mundo encantado pude recordar. Em fábulas bordei a fantasia. Ê, saudade que mareja o meu olhar.
Herdeiro dessa terra me tornei. Cantei nossos recantos, tradições. Sou eu aquele festival de prata. Que na pista arrebata tantos corações.
Ô ô ô ô, axé que no sangue herdei. No meu quilombo, todo negro é rei. Abre a senzala! Abre a senzala, ô!. Nesse terreiro o samba é a voz que não cala. Abre a senzala! Abre a senzala, ô!. Nesse terreiro o samba é a voz que não cala.
Cresci ouvindo acordes entre doces melodias. A bela dama retratada em poesia, e o canto de cristal. A simplicidade no amor, aquele beijo na flor. Fez mais um sonho real.
Pátria amada da ganância. Eu pedi socorro pelos filhos teus. Algoz da intolerância. Mesmo proibido, fui a voz de Deus.
Toda essa grandeza vem da nossa gente. Que esquece a dor e só quer sambar. É por esse amor que o meu valor me faz brilhar. Comunidade me ensinou. A ser apaixonado como eu sou, eu sou. Ontem, hoje, sempre Beija-Flor."
União da Ilha;Samba-Enredo;2019;;"[Enredo: A Peleja Poética Entre Rachel e Alencar No Avarandado do Céu.
Vixe Maria! A ilha a cantar. Traçando em meus versos a minha alegria. Menina rendeira, me ensina a bordar. No céu, emoção; no chão, simpatia.
Vixe Maria! A ilha a cantar. Traçando em meus versos a minha alegria. Menina rendeira, me ensina a bordar. No céu, emoção; no chão, simpatia.
O Sol. Onde aquece a inspiração é luz. Meu sonho. É vida, vento, brisa à beira mar. Ouvindo poesias de Rachel. Suspiro nas histórias de Alencar. E hoje desfolhando meu cordel. Das lendas que ouvi no Ceará. É doce, é fogo, sabor e prazer. Aroma no ar, plantar e colher. Eu moldei no barro. As recordações que vivi com você.
Violeiro toca moda à luz do luar. Sanfoneiro puxa o fole e convida a dançar. Vou pedir a Padim Ciço, abençoe nosso povo. Essa fé vai nos guiar.
Violeiro toca moda à luz do luar. Sanfoneiro puxa o fole e convida a dançar. Vou pedir a Padim Ciço, abençoe nosso povo. Essa fé vai nos guiar.
Chão rachado, meu sertão. Peço a Deus pra alumiar. Terra seca que não seca a esperança. Arretada vocação de te amar. O sal da terra segue o meu destino. Sangue nordestino sempre a me orgulhar. A natureza cantada em meus versos. Traduz a beleza desse meu lugar.
Linda morena vestiu-se de amor. Teceu a vida com fios dourados. Eu, de chapéu de couro e gibão. Enfeitei o meu coração. E na moda desfilou ao seu lado."
Beija Flor de Nilópolis;Samba-Enredo;2018;;"Oh pátria amada, por onde andarás?. Seus filhos já não aguentam mais!. Você que não soube cuidar. Você que negou o amor. Vem aprender na beija-flor.
Sou eu. Espelho da lendária criatura. Um mostro carente de amor e de ternura. O alvo na mira do desprezo e da segregação. Do pai que renegou a criação. Refém da intolerância dessa gente. Retalhos do meu próprio criador. Julgado pela força da ambição. Sigo carregando a minha cruz. A procura de uma luz, a salvação!.
Estenda a mão meu senhor. Pois não entendo tua fé. Se ofereces com amor. Me alimento de axé. Me chamas tanto de irmão. E me abandonas ao léu. Troca um pedaço de pão. Por um pedaço de céu.
Ganância veste terno e gravata. Onde a esperança sucumbiu. Vejo a liberdade aprisionada. Teu livro eu não sei ler, brasil!. Mas o samba faz essa dor dentro do peito ir embora. Feito um arrastão de alegria e emoção o pranto rola. Meu canto é resistência. No ecoar de um tambor. Vêm ver brilhar. Mais um menino que você abandonou."
Deu Chucha na Zebra;Samba-Enredo;2019;;"Louco é o meu coração. Muito louco por esse pavilhão. Deu chucha na zebra. Faz o povo delirar. Eu quero ver Uruguaiana pirar.
A mente viaja, divaga. Na desordenada razão. É tempo de virar o mundo todo. Recriar o reino da imaginação. Insana memória. Fazendo historia. Um grito ecoou, sonho incrível!. É real, o impossível. De preto e branco, louco vem ser. É hora de enlouquecer.
Pirei, voou, virou paixão. Decolei nas asas da imaginação. Ao sabor do vento, loucura no ar. Nem mesmo louco vou deixar de te amar (chucha).
Da ficção, um albatroz. Alienada bruxaria. Delirante ilusão, sou paixão sem cura. Criador e criatura. Enlouqueci!. Pelas ruas, delirei. Uma artista alucinado. Na avenida, um rei. Olhando no espelho. Eu volto no tempo. 40 anos de um lindo sentimento. Tô desvairado de amor. Onde estiver estou."
Paraíso do Tuiuti;Samba-Enredo;2019;;"[Enredo: O Salvador da Pátria.
O meu Bode tem cabelo na venta. O Tuiuti me representa. Meu Paraíso escolheu o Ceará. Vou bodejar láiá, láiá.
O meu Bode tem cabelo na venta. O Tuiuti me representa. Meu Paraíso escolheu o Ceará. Vou bodejar láiá, láiá.
Vendeu-se o Brasil num palanque da praça. E ao homem serviu ferro, lodo e mordaça. Vendeu-se o Brasil do sertão até o mangue. E o homem servil verteu lágrimas de sangue.
Do nada, um Bode vindo lá do interior. Destino pobre, nordestino sonhador. Vazou da fome, retirante ao Deus dará. Soprou as chamas do Dragão do Mar.
Passava o dia ruminando poesia. Batendo cascos no calor dos mafuás. Bafo de bode perfumando a boemia. Levou no colo Iracema até o cais. Com luxo não! Chão de capim!. Nasceu Muderna fortaleza pro bichim.
Pega na viola, diz um verso pra iô iô. O salvador! O salvador!. Pega na viola, diz um verso pra iô iô. O salvador! O salvador! (Da pátria!).
Ora, meu patrão. Vida de gado desse povo tão marcado. Não precisa de dotô. Quando clareou o resultado. Tava o Bode ali sentado. Aclamado o vencedor.
Nem berrar, berrou, sequer assumiu. Isso aqui, iôiô, é um pouquinho de Brasil. Nem berrar, berrou, sequer assumiu. Isso aqui, iôiô, é um pouquinho de Brasil."
Águia de Ouro;Samba-Enredo;2019;;"[Enredo: Brasil, Eu Quero Falar de Você! Que País É Esse?.
Meu Deus, escute a Águia cantar. Oh Pai, lhe peço: Olhai por nós!. Somos filhos desta pátria. Que não cuida do que é seu. E não ouve a nossa voz.
Meu Deus, escute a Águia cantar. Oh Pai, lhe peço: Olhai por nós!. Somos filhos desta pátria. Que não cuida do que é seu. E não ouve a nossa voz.
Mãe, por que não te fizeste mais gentil?. Mãe! Por eles batizada de Brasil. Para onde foi o teu olhar. Quando do mar se aproximou. A caravela da ganância. A ambição do invasor?. O teu herdeiro então chorou. Derramou seu sangue em vão. E nos tornamos os escravos do próprio chão. ​. Ontem presos na senzala, maldade e dor. O negro suplicava: Ó, meu Senhor!. Hoje amargo preconceito. Liberdade é uma quimera. Viver livre, quem me dera!.
Ontem presos na senzala, maldade e dor. O negro suplicava: Ó, meu Senhor!. Hoje amargo preconceito. Liberdade é uma quimera. Viver livre, quem me dera!.
Vejam só que ironia. Da colônia à monarquia, por aqui nada mudou. Imperava uma história mal contada. Logo após republicada pelas mãos do ditador. Em planos, um país descolorido. Saqueado e dividido. O poder de quem tem mais. A farra das elites sociais. E o povo na rua, revestido de coragem. Lava a alma de esperança. Pra acabar com a sacanagem."
Acadêmicos do Cubango;Samba-Enredo;2019;;"Vou buscar pra mim a força do seu axé. Menino babalotim no sagrado afoxé. Menino babalotim no sagrado afoxé.
Aos pés do morro fiz o meu terreiro. Onde o padroeiro me protege em seu altar. Atoto eu bato cabeça pra omulu. Nesse chão tem pipoca pro santo. Oferendas do meu mundo verde e branco.
Ê saruê baiana, ê saruê baiana. Gira laguidibá, giram saias e guias. Carrega meu patuá em sua sabedoria.
Ê saruê baiana, ê saruê baiana. Gira laguidibá, giram saias e guias. Carrega meu patuá em sua sabedoria.
Búzios, carrancas e balangandãs. Relíquias iluminam meu caminho. Ao meu padim, eu amarro a minha fé. A cruz no peito pra me abençoar. Já fiz a promessa, o milagre vai chegar.
Em Romaria, eu agradeci. Desacreditado, acreditei. A cura da alma, o terço na mão. Um coração bordado ao Divino Rei.
Senhor, tem piedade de nós. Eis a oração em nossa voz. Tem gente vendendo, ao povo, ilusão. Acendo vela, peço salvação.
Ko si oba kan, ôôô. Ofi olorum, ôôô. Igba Cubango, meu amuleto. Proteção e amor.
Ko si oba kan, ôôô. Ofi olorum, ôôô. Igba Cubango, meu amuleto. Proteção e amor.
Vou buscar pra mim a força do seu axé. Menino babalotim no sagrado afoxé. Menino babalotim no sagrado afoxé."
Dragões da Real;Samba-Enredo;2019;;"[Enredo: A Invenção do Tempo. Uma Odisseia em 65 Minutos.
Quando a sirene tocar. Vai eternizar tamanha emoção. Será a história mais linda. Marcada pelo coração.
Quando a sirene tocar. Vai eternizar tamanha emoção. Será a história mais linda. Marcada pelo coração.
Quem sonhar, vai viver essa vitória. Lutar e vencer é nossa raiz. Avante, Dragões, chegou sua hora. É tempo de ser feliz.
Quem sonhar, vai viver essa vitória. Lutar e vencer é nossa raiz. Avante, Dragões, chegou sua hora. É tempo de ser feliz.
(Meu amor).
Amor. Nada será como antes. Tudo vai se transformar. O guardião do destino. Num sopro divino. Vai nos revelar.
O homem buscou dominar. Segundos contados na areia. A cada invenção. Nos ponteiros da ilusão.
Desvendar o futuro que virá. Viajar no passado e aprender. O presente mudar. Tudo pode acontecer.
Eu quero ver desvendar o futuro que virá. Viajar no passado e aprender. O presente mudar. Tudo pode acontecer.
Somos escravos da hora. Senhores do agora. Num mundo veloz. Será que é o tempo que passa. Ou quem passa somos nós?."
Império de Casa Verde;Samba-Enredo;2019;;"[Enredo: O Império Contra Ataca.
Vem ver o meu império a brilhar. Um filme pra te emocionar. Prepare o coração. E deixe o tigre te levar.
A luz da imaginação. Que ganha projeção e se eterniza. Reluz em nossos corações. Transborda emoções nessa avenida. Guiado pelo encanto do mundo em preto e branco. Deixa o vento me levar que eu vou. Pelos jardins num lindo toque de magia. Pode chover que eu vou cantar de alegria. Encontro além do arco-íris um castelo. Seguindo a estrada de tijolos amarelos.
A batalha do bem e do mal entra em cena. Toda fantasia invade o cinema. Tem bruxaria no ar, mil maravilhas contar. É aventura, ninguém segura.
Romances que tanto marcaram. Não foram deixados no fundo do mar. O futuro não espera. É nova era numa odisseia espacial. Tudo vai se transformar. Tudo pode acontecer. Imperiano, que a força esteja com você. E a Casa Verde mais uma vez vem deslumbrar a passarela. O nosso elenco dando show na sua tela. Seja você um personagem. A grande estrela da sétima arte."
Mocidade Alegre;Samba-Enredo;2019;;"[Enredo: Ayakamaé - As Águas Sagradas do Sol e da Lua.
(Amazonas, Amazonas, meu amor!).
Meu canto é guerreiro, sou Mocidade. Vermelho no sangue e na cor. Vou pelas águas que Tupã abençoou. Amazonas, meu amor!.
Meu canto é guerreiro, sou Mocidade. Vermelho no sangue e na cor. Vou pelas águas que Tupã abençoou. Amazonas, Amazonas, meu amor!.
Eu sou o verdadeiro dono dessa terra. Mareja em meu olhar. Todo o encanto dessas águas. Ayakamaé, um rio de amor. Deságua em ti, das lágrimas de prata do luar. Em noite proibida de amar. O brilho que aquece a manhã. Um santuário de vida floresceu. Na proteção de bravos Manaós. Yara seduz ao cantar. Na correnteza a caminho do mar.
Ariê auê, na mata ecoou. O toque do tambor. Na reza do pajé um ritual. Do rio sagrado, a cura pra vencer o mal.
Ariê auê, na mata ecoou. O toque do tambor. Na reza do pajé um ritual. Do rio sagrado, a cura pra vencer o mal.
Ê, caboclo da pele morena. Que faz da palha trançada um poema. Pra descrever todo o suor da sua lida. A fé conduz, nesse banzeiro, a sua vida. O Sol beijando as águas ao entardecer. Encontra a Lua pra fazer valer. A jura eterna de uma paixão. Transborda dentro do meu peito. As águas da inspiração. Que faz morada em cada coração.
Meu canto é guerreiro, sou Mocidade. Vermelho no sangue e na cor. Vou pelas águas que Tupã abençoou. Amazonas, meu amor!.
Meu canto é guerreiro, sou Mocidade. Vermelho no sangue e na cor. Vou pelas águas que Tupã abençoou. Amazonas, Amazonas, meu amor!."
